Client,Contact Channel,Project Type,Item / Project,Current Status,Promised Next Step,Next Action Owner,Client Deadline,Internal Due Date,Last Client Contact,Next Follow-Up Date,Risk Level,Risk Reason,Latest Client Update Draft,Notes
Mrs Tan,WhatsApp,Repair,Ring resizing,Waiting on workshop confirmation,Confirm whether ready by Friday,Jeweler,2026-06-05,2026-06-04,2026-05-28,2026-05-30,Amber,Supplier timing not confirmed,"Hi Mrs Tan, just a quick update — we’re checking with the workshop and currently expecting the ring around Thursday. I’ll confirm again with you tomorrow so you’re not left waiting.",Client anxious because piece is needed before weekend
Rachel,Instagram,Custom order,18k birthstone pendant,Design options sent; waiting for client decision,Follow up for design selection,Jeweler,2026-06-20,2026-06-03,2026-05-26,2026-05-29,Red,No reply for 3 days and production slot may slip,"Hi Rachel, just checking in on the pendant designs I sent over. If you’d like the piece ready by 20 June, it would be best to confirm the design this week so I can reserve the production slot.",Potential gift deadline
Mr Lee,WhatsApp,Redesign,Reset grandmother's jade ring,Quote pending from goldsmith,Send revised quote after supplier confirms,Goldsmith / Jeweler,2026-06-15,2026-05-31,2026-05-27,2026-05-30,Amber,Waiting on supplier quote,"Hi Mr Lee, I’m still waiting for the final workshop quote for the jade ring reset. I’ll update you by tomorrow even if the workshop has not reverted, so you know where things stand.",Sent photos already
Amelia,Walk-in,Custom order,Wedding band engraving,In production,Confirm engraving proof before final polish,Jeweler,2026-06-10,2026-06-02,2026-05-28,2026-05-31,Green,On track,"Hi Amelia, your wedding band is in production. I’ll send you the engraving proof before final polish so you can confirm everything looks right.",High emotional importance
Sophie,WhatsApp,Cleaning,Necklace cleaning and clasp check,Ready for pickup,Remind client to collect,Staff,2026-06-01,2026-05-29,2026-05-24,2026-05-29,Amber,Ready but client has not collected,"Hi Sophie, your necklace cleaning and clasp check are complete and ready for pickup. Let me know when you’d like to come by and I’ll keep it aside for you.",Small job but easy to forget
